"Epic","Feature","Story","FAILED","BROKEN","PASSED","SKIPPED","UNKNOWN"
"","Deck Management","User can assign a card to themselves","0","1","1","0","0"
"","Deck Management","User can create a new board","0","0","5","0","0"
"","Calendar module functionality","user can display daily calendar view","0","0","1","0","0"
"","Deck Management","User can create a new list of card under any board","0","0","5","0","0"
"","Deck Management","User can add a new card on any list on the current board","0","0","5","0","0"
"","Calendar module functionality","user can display monthly calendar view","0","0","1","0","0"
"","Calendar module functionality","user can display weekly calendar view","0","0","1","0","0"
"","Calendar module functionality","user can create a new event under the Calendar module","0","1","0","0","0"
